Title,Authors,Publisher,Published Date,Description,Categories,Page Count,Average Rating,Ratings Count,Language
C++ for Business Programming,John C. Molluzzo,Prentice Hall,2006,"This book provides a highly readable introduction to C++ programming for beginning business programmers. It guides readers through complete and clear descriptions of sample programs, with a wealth of exercises included along the way to help reinforce the important points of each chapter. Throughout the text, a strong emphasis is placed on business applications, rather than those in mathematics or computing. Part I (Basic C++) covers the procedural parts of C++. Part II (Object-Oriented Concepts and Programming) introduces object-oriented ideas through the built-in string class. Part III (Object-Oriented Programming) explores the essential object-oriented ideas through inheritance and polymorphism. For beginning programmers using C++ for business.",Computers,848,N/A,0,en
C-Scape,Larry Kramer,Harper Collins,2010-11-02,"“[Larry Kramer’s] MarketWatch.com is not just my favorite business website, it’s my personal homepage.” —Warren Buffett “[Larry Kramer] is the toughest and most ethical foe imaginable. His observations reflect a deep understanding of how the media works and what consumers want.” —Jim Cramer From Larry Kramer, the founder of MarketWatch.com and former president of CBS Digital Media, comes a bold, pioneering report on what businesses must do to survive and thrive in the digital media revolution. Using case studies of companies such as Apple, Procter & Gamble, Netflix, and GE, Kramer not only draws a clear map of twenty-first century commerce, but charts the way forward. Readers wondering how to implement digital-age business strategies like those found in Clay Shirky’s Here Comes Everybody, Chris Anderson’s The Long Tail, or Jeff Jarvis’ What Would Google Do, look no further than Kramer’s groundbreaking C-Scape.",Business & Economics,248,N/A,0,en
Business Communication,Jonah C. Pardillo,Society Publishing,2018-12,"Business communication examines various aspects of communication in business including an extensive historical overview and introduction of business communication and overcoming barriers to communication. It includes definitions of internal communication, external communication along with oral communication that talks about the power of speech. Provides the reader with insights into the development of its history, so as to understand the business communication and the role writing skills play in an effective business communication along with various applications of business communication in cross-cultural communications.",Business & Economics,0,N/A,0,en
Business Not As Usual,Sharon C. Cooper,Penguin,2022-04-05,"A woman learns the hard way about mixing business with pleasure in this hilarious new romantic comedy by USA Today bestselling author Sharon C. Cooper. I am beautiful. I am confident. I am lovable. I am a lottery winner. This is the mantra that will get Dreamy Daniels through each day until she makes it big. So what if she lives in a seedy part of Los Angeles in a house that’s one earthquake away from crumbling, or works an unfulfilling secretarial job while struggling to finish her bachelor’s degree? All Dreamy needs to do is win the lottery, which she’s been entering in as a weekly tradition with her grandfather. When she catches the attention of her boss’s potential investor, Dreamy has to remind herself to focus on her career goals so she can be her own boss. Who cares if he has the social grace of the Duke of Sussex and the suaveness of Idris Elba? No distractions allowed. Growing up with a father who is an A-list actor and a socialite mother, venture capitalist Karter Redford lives in the world of the rich and famous. Instead of attending movie premieres, however, he prefers spending his time helping the less fortunate, backing start-up companies and investing in cutting edge ideas. Karter is used to his life revolving around work, but when he decides he wants someone to share it with, he falls for someone his mother would never approve of: hilarious, quirky Dreamy, who has goals of her own…but also isn’t a wealthy, upper-crust socialite. Though it’s clear they’re from different worlds, their relationship might just be his greatest investment yet.",Fiction,321,N/A,0,en
Introduction to Business,"Lawrence J. Gitman, Carl McDaniel, Amit Shah, Monique Reece, Linda Koffel, Bethann Talsma, James C. Hyatt",,2024-09-16,"Introduction to Business covers the scope and sequence of most introductory business courses. The book provides detailed explanations in the context of core themes such as customer satisfaction, ethics, entrepreneurship, global business, and managing change. Introduction to Business includes hundreds of current business examples from a range of industries and geographic locations, which feature a variety of individuals. The outcome is a balanced approach to the theory and application of business concepts, with attention to the knowledge and skills necessary for student success in this course and beyond. This is an adaptation of Introduction to Business by OpenStax. You can access the textbook as pdf for free at openstax.org. Minor editorial changes were made to ensure a better ebook reading experience. Textbook content produced by OpenStax is licensed under a Creative Commons Attribution 4.0 International License.",Business & Economics,1455,N/A,0,en
Like Nobody's Business,Andrew C. Comrie,Open Book Publishers,2021-02-23,"How do university finances really work? From flagship public research universities to small, private liberal arts colleges, there are few aspects of these institutions associated with more confusion, myths or lack of understanding than how they fund themselves and function in the business of higher education. Using simple, approachable explanations supported by clear illustrations, this book takes the reader on an engaging and enlightening tour of how the money flows. How does the university really pay for itself? Why do tuition and fees rise so fast? Why do universities lose money on research? Do most donations go to athletics? Grounded in hard data, original analyses, and the practical experience of a seasoned administrator, this book provides refreshingly clear answers and comprehensive insights for anyone on or off campus who is interested in the business of the university: how it earns its money, how it spends it, and how it all works.",Education,422,N/A,0,en
LA/C Business Bulletin,,N/A,1991,N/A,Caribbean Area,352,N/A,0,en
"A History of Socially Responsible Business, c.1600–1950","William A Pettigrew, David Chan Smith",Springer,2017-10-26,"This book examines the changing reciprocal relationships between corporations and their various social obligations over the very long term - from the seventeenth to the twentieth century. Chapters from emerging and established business historians assess the full range of social obligations that corporations held historically. By adopting an innovative methodological approach that is long-term and comparative, this book offers a challenge to the literature on corporate history and will be of interest to researchers and academics in the field of finance and business history.",Business & Economics,320,N/A,0,en
The Code of Federal Regulations of the United States of America,,N/A,1969,The Code of Federal Regulations is the codification of the general and permanent rules published in the Federal Register by the executive departments and agencies of the Federal Government.,Administrative law,268,N/A,0,en
The War on Small Business,Carol Roth,HarperCollins,2021-06-29,"For years, government bureaucrats have been looking for ways to destroy small businesses. With coronavirus, they finally had their chance. In 2020, the American economy suffered the biggest financial collapse in history. But while Main Street suffered like never before, the stock market continued to reach new highs. How could this be?The answer is that government had slapped oppressive restrictions on small businesses while propping up Wall Street and engineering a historic consolidation of power and wealth. This isn’t a new problem. During the last financial crisis, Washington bailed out large banks, saying they were “too big to fail.” When the federal government finally pushed out the CARES Act in 2020, it clearly favored the wealthy and well-connected, showing that small businesses were too small to matter. People across the political spectrum constantly complain about the tyranny of big business, and they’re not wrong. However, too many think government is the solution. In reality, government is the problem. In The War on Small Business, entrepreneur Carol Roth unveils the many abuses of power inflicted on small businesses during the COVID-19 pandemic. Small business owners were thrown in jail for trying to make a living. Individual rights were discarded. Big government did what it does best—intentionally protect the rich and powerful. This is the most underreported story coming out of the pandemic. The government chose winners and losers, who would thrive and who would fight to survive, based on not data or science, but based on clout and connections. This enabled the government, with the aid of the Federal Reserve, to oversee the largest wealth transfer in history from Main Street to Wall Street. The issues started long ago and continue today with a highly tilted playing field that favors those “in the club” to the detriment of the average Americans. This book is about the Davids vs. the Goliaths and the decentralization that can help the small, independent businesses and individuals participate in wealth creation. If Americans don’t wake up and stop it, politicians will continue to produce policies that intensify their war on small business and individuals and all that stands in the way of centralized power and control.",Political Science,380,N/A,0,en
Code of Federal Regulations,,N/A,2000,"Special edition of the Federal Register, containing a codification of documents of general applicability and future effect ... with ancillaries.",Administrative law,1084,5,1,en
Business Chemistry,"Kim Christfort, Suzanne Vickberg",John Wiley & Sons,2018-05-22,"A guide to putting cognitive diversity to work Ever wonder what it is that makes two people click or clash? Or why some groups excel while others fumble? Or how you, as a leader, can make or break team potential? Business Chemistry holds the answers. Based on extensive research and analytics, plus years of proven success in the field, the Business Chemistry framework provides a simple yet powerful way to identify meaningful differences between people’s working styles. Who seeks possibilities and who seeks stability? Who values challenge and who values connection? Business Chemistry will help you grasp where others are coming from, appreciate the value they bring, and determine what they need in order to excel. It offers practical ways to be more effective as an individual and as a leader. Imagine you had a more in-depth understanding of yourself and why you thrive in some work environments and flounder in others. Suppose you had a clearer view on what to do about it so that you could always perform at your best. Imagine you had more insight into what makes people tick and what ticks them off, how some interactions unlock potential while others shut people down. Suppose you could gain people’s trust, influence them, motivate them, and get the very most out of your work relationships. Imagine you knew how to create a work environment where all types of people excel, even if they have conflicting perspectives, preferences and needs. Suppose you could activate the potential benefits of diversity on your teams and in your organizations, improving collaboration to achieve the group’s collective potential. Business Chemistry offers all of this--you don’t have to leave it up to chance, and you shouldn’t. Let this book guide you in creating great chemistry!",Business & Economics,311,N/A,0,en
Small Business Petroleum and Petrochemical Marketers Protection Act of 1975,United States. Congress. House. Committee on Small Business. Subcommittee on SBA and SBIC Legislation,N/A,1976,N/A,Petroleum chemicals industry,788,N/A,0,en
Self-employment Tax,,N/A,1988,N/A,Income tax,12,N/A,0,en
"Book Business: Publishing Past, Present, and Future",Jason Epstein,W. W. Norton & Company,2011-02-07,"""An irresistible book about Grub Street, authorship and the literary marketplace.""—Washington Post Book World Jason Epstein has led arguably the most creative career in book publishing during the past half-century. He founded Anchor Books and launched the quality paperback revolution, cofounded the New York Review of Books, and created of the Library of America, the prestigious publisher of American classics, and The Reader's Catalog, the precursor of online bookselling. In this short book he discusses the severe crisis facing the book business today—a crisis that affects writers and readers as well as publishers—and looks ahead to the radically transformed industry that will revolutionize the idea of the book as profoundly as the introduction of movable type did five centuries ago.",Biography & Autobiography,203,N/A,0,en
Principles of Federal Appropriations Law,,N/A,2004,N/A,Electronic government information,658,N/A,0,en
United States Code,United States,N/A,2008,N/A,Law,1376,N/A,0,en
Package X,United States. Internal Revenue Service,N/A,1992,N/A,Tax returns,378,N/A,0,en
Congressional Record,United States. Congress,N/A,1962,N/A,Law,832,N/A,0,en
Comprehensive Guide to the Insolvency Professional Examination,Rajeev Babel,Bloomsbury Publishing,2021-05-30,"Highlights ? More than 5300 MCQs with Answers and Reference. ? Contains upto date laws on Insolvency & Bankruptcy Code, 2016, its Rules and Regulations and Circulars. ? Completely revamped to include MCQs and legislation as per the latest syllabus of IBBI w.e.f. 1st January 2021. ? Covers cases decided by the Supreme Court, High Courts, NCLAT and NCLT covering facts of the case, issue involved and decision given by courts, as per the syllabus. ? Contains separate chapters with case analysis of CIRP/ Individual Insolvency Resolution. Complete coverage of syllabus as notified w.e.f. 1st January 2021 with more than 5300 MCQs (updated upto 31st December, 2020) ? The Insolvency and Bankruptcy Code, 2016, Its Rules, Regulations and Circulars issued under the Code till 31st December, 2020) ? Relevant Chapter of The Companies Act, 2013 ? The Indian Partnership Act, 1932 ? The Limited Liability Partnership Act, 2008 ? The Indian Contract Act, 1872 ? The Negotiable Instruments Act, 1881 ? The Sale of Goods Act, 1930 ? The Transfer of Property Act, 1882 ? The Code of Civil Procedure, 1908 ? The Limitation Act, 1963 ? The Prevention of Corruption Act, 1988 ? The Prevention of Money Laundering Act, 2002 ? The Recovery of Debts and Bankruptcy Act, 1993 ? The Arbitration and Conciliation Act, 1996 ? The Securitisation and Reconstruction of Financial Assets and Enforcement of Security Interests Act, 2002 ? The Micro, Small and Medium Enterprises Development Act, 2006 ? The Real Estate (Regulation and Development) Act, 2016 ? Securities and Contracts Regulation Act, 1956 ? Relevant SEBI Regulations: - SEBI (ICDR) Regulations, 2009 - SEBI (ICDR) Regulations, 2018 - SEBI (Delisting of Equity Shares) Regulations, 2009 - SEBI (SAST) Regulations, 2011 - SEBI (LODR) Regulations, 2015 ? Finance and Accounts (Corporate Finance; Financial Analysis; Liquidity Management; Tax Planning and GST) ? General Awareness - Constitution of India (Right to Constitutional Remedies; provisions of Union Judiciary; provisions of High Courts in the States) - Rights of Workmen under Labour Laws (The Code of Social Security, 2020, The Code of Wages, 2019, The Industrial Relations Code, 2020, The Occupational Safety, Health and Working Conditions Code, 2020 - Economy - Financial Markets - Basic concepts of Valuation - Forensic Audit ? Important decisions of Supreme Court and High Courts, Decisions of NCLAT and NCLT relating to Insolvency ? Case Analysis of CIRP & Liquidation / Individual Insolvency Resolution / Business and Professional Ethics ? MCQs based on Various decisions of Courts ? Model Question Papers",Law,2311,N/A,0,en
"Catalog of Copyright Entries, Third Series",,N/A,1950,"The record of each copyright registration listed in the Catalog includes a description of the work copyrighted and data relating to the copyright claim (the name of the copyright claimant as given in the application for registration, the copyright date, the copyright registration number, etc.).",Copyright,1110,N/A,0,en
Information,United States. Farmer Cooperative Service,N/A,1955,N/A,Agriculture,1102,N/A,0,en
Principles of Real Estate Practice in Maryland: 1st Edition,"Stephen Mettling, David Cusic, Jane Somers",Performance Programs Company,2021-03,"Principles of Real Estate Practice in Maryland contains the essentials of the national and Maryland real estate law, principles, and practices necessary for basic competence as a real estate professional and as mandated by Maryland license law. It is based on our highly successful and popular national publication, Principles of Real Estate Practice, which is in use in real estate schools nationwide. The text is tailored to the needs of the pre-license student. It is designed to - make it easy for students to learn the material and pass their real estate exam - prepare students for numerous career applications - stress practical, rather than theoretical, skills and knowledge. Principles of Real Estate Practice in Maryland is streamlined, direct and to-the-point. It includes multiple learning reinforcements. It has a student-oriented organization, both within each chapter and from chapter to chapter. Its examples and exercises are grounded in the authors' many years in real estate education. Table of Contents The Real Estate Business Rights in Real Estate Interests and Estates Ownership Encumbrances and Liens Transferring and Recording Title to Real Estate Leasing Essentials Land Use Planning and Control Legal Descriptions Fundamentals of Contract Law National Agency Listing Agreements: An Overview General Brokerage Practices Overview of Conveyance Contracts Real Estate Market Economics Appraising and Estimating Market Value Real Estate Finance Real Estate Investment Real Estate Taxation Professional Practices Closings Overview of Licensing and Regulation Risk Management Property Management The Maryland Regulatory Environment Maryland Licensing Requirements Maryland Regulation of Business Conduct Maryland Brokerage Relationships and Disclosure Ethical Practices and Fair Housing Other Maryland Laws and Practices Glossary of Residential Style and Construction Terms Glossary of General Real Estate Terms Index For students looking for a Maryland exam prep book, we also publish Maryland Real Estate License Exam Prep.",Law,604,N/A,0,en
List of Courses Offered by Cooperating Colleges and Universities Through United States Armed Forces Institute,United States. War Department,N/A,1946,N/A,Soldiers,260,N/A,0,en
The Massachusetts register,,N/A,2016,N/A,,320,N/A,0,en
Business as Mission,C. Neal Johnson,InterVarsity Press,2011-10-10,"C. Neal Johnson offers the first comprehensive guide to business as mission (BAM) for practitioners. He provides conceptual foundationas for understanding BAM's unique place in global mission and prerequisites for engaging in it. Then he offers practical resources for how to do BAM, including strategic planning and step-by-step operational implementation.",Religion,529,5,1,en
One-bank Holding Company Legislation of 1970,United States. Congress. Senate. Committee on Banking and Currency,N/A,1970,N/A,,1480,N/A,0,en
BEHAVIORAL ECONOMICS,NARAYAN CHANGDER,CHANGDER OUTLINE,2023-11-25,"THE BEHAVIORAL ECONOMICS MCQ (MULTIPLE CHOICE QUESTIONS) SERVES AS A VALUABLE RESOURCE FOR INDIVIDUALS AIMING TO DEEPEN THEIR UNDERSTANDING OF VARIOUS COMPETITIVE EXAMS, CLASS TESTS, QUIZ COMPETITIONS, AND SIMILAR ASSESSMENTS. WITH ITS EXTENSIVE COLLECTION OF MCQS, THIS BOOK EMPOWERS YOU TO ASSESS YOUR GRASP OF THE SUBJECT MATTER AND YOUR PROFICIENCY LEVEL. BY ENGAGING WITH THESE MULTIPLE-CHOICE QUESTIONS, YOU CAN IMPROVE YOUR KNOWLEDGE OF THE SUBJECT, IDENTIFY AREAS FOR IMPROVEMENT, AND LAY A SOLID FOUNDATION. DIVE INTO THE BEHAVIORAL ECONOMICS MCQ TO EXPAND YOUR BEHAVIORAL ECONOMICS KNOWLEDGE AND EXCEL IN QUIZ COMPETITIONS, ACADEMIC STUDIES, OR PROFESSIONAL ENDEAVORS. THE ANSWERS TO THE QUESTIONS ARE PROVIDED AT THE END OF EACH PAGE, MAKING IT EASY FOR PARTICIPANTS TO VERIFY THEIR ANSWERS AND PREPARE EFFECTIVELY.",Business & Economics,46,N/A,0,en
Internal Revenue Bulletin,United States. Bureau of Internal Revenue,N/A,1922,N/A,Taxation,532,N/A,0,en
"Defense Production Act, Progress Report",United States. Congress Defense Production Joint Committee,N/A,1951,N/A,,1880,N/A,0,en
商务英语听说教程(第2册),,清华大学出版社有限公司,2007,高等学校商务英语系列教材,,238,N/A,0,en
GERUND PHRASES,NARAYAN CHANGDER,CHANGDER OUTLINE,2024-01-11,"THE GERUND PHRASES MCQ (MULTIPLE CHOICE QUESTIONS) SERVES AS A VALUABLE RESOURCE FOR INDIVIDUALS AIMING TO DEEPEN THEIR UNDERSTANDING OF VARIOUS COMPETITIVE EXAMS, CLASS TESTS, QUIZ COMPETITIONS, AND SIMILAR ASSESSMENTS. WITH ITS EXTENSIVE COLLECTION OF MCQS, THIS BOOK EMPOWERS YOU TO ASSESS YOUR GRASP OF THE SUBJECT MATTER AND YOUR PROFICIENCY LEVEL. BY ENGAGING WITH THESE MULTIPLE-CHOICE QUESTIONS, YOU CAN IMPROVE YOUR KNOWLEDGE OF THE SUBJECT, IDENTIFY AREAS FOR IMPROVEMENT, AND LAY A SOLID FOUNDATION. DIVE INTO THE GERUND PHRASES MCQ TO EXPAND YOUR GERUND PHRASES KNOWLEDGE AND EXCEL IN QUIZ COMPETITIONS, ACADEMIC STUDIES, OR PROFESSIONAL ENDEAVORS. THE ANSWERS TO THE QUESTIONS ARE PROVIDED AT THE END OF EACH PAGE, MAKING IT EASY FOR PARTICIPANTS TO VERIFY THEIR ANSWERS AND PREPARE EFFECTIVELY.",Education,57,N/A,0,en
"One-bank Holding Company Legislation of 1970: May 12, 14, 15, 18, 19, 20, 21, and 22, 1970",United States. Congress. Senate. Committee on Banking and Currency,N/A,1970,N/A,Bank holding companies,714,N/A,0,en
CBAP® Certification and BABOK® Study Guide,Hans Jonasson,CRC Press,2016-10-26,"The book covers all knowledge areas from the BABOK®, Third Edition, and is designed to be a study guide for the CBAP® certification from IIBATM. It includes over 300 sample questions. It is also usable for those seeking the PMI-PBA® certification. This book is a complete business analysis handbook combining the latest standards from the BABOK® case study examples and exercises with solutions. It has usable tools and techniques, as well as templates ready to be used to develop solid requirements to be the cornerstone for any successful product development.",Business & Economics,314,N/A,0,en
"Current Estimates from the National Health Interview Survey, United States",,N/A,1981,N/A,Diseases,474,N/A,0,en
"Business, the Magazine for Office, Store and Factory",,N/A,1901,N/A,Business,1528,N/A,0,en
Code of Federal Regulations,United States. Internal Revenue Service,N/A,2013,"Special edition of the Federal register, containing a codification of documents of general applicability and future effect as of April 1 ... with ancillaries.",Drugs,924,N/A,0,en
Internal Revenue Cumulative Bulletin,United States. Internal Revenue Service,N/A,1992,N/A,Tax administration and procedure,920,N/A,0,en
Publication,,N/A,1964,N/A,Income tax,44,N/A,0,en
Cumulative List of Organizations Described in Section 170 (c) of the Internal Revenue Code of 1954,,N/A,1999,N/A,"Charitable uses, trusts, and foundations",908,N/A,0,en
Business--a Profession,Louis Dembitz Brandeis,N/A,1914,N/A,Business & Economics,400,N/A,0,en
"Business, Information Technology and Society",Stephen D. Tansey,Routledge,2003-10-02,"This comprehensive volume introduces the nature and the impact of the new information and communication technologies on business and society. Emphasizing the global impact, it draws upon examples from the USA, Europe, and Japan as well as the newly industrialized countries of the Pacific Rim. Applying a systems thinking approach, author Stephen D. Tansey covers: the environment of computing the IT industry, government and the information economy - and the recent development of e-government initiatives the need to regulate computing the role of IT in the workplace: its effect on organizations and jobs the impact of IT on society at large. Written for students studying business or IT, this book is an invaluable resource offering topical insights into the ways in which information technology is shaping our work and our lives. Without assuming any prior knowledge of either business or IT, this key text provides a unique, essential guide.",Computers,276,N/A,0,en
Internal Revenue Cumulative Bulletin,United States. Internal Revenue Service,N/A,2001,N/A,Tax administration and procedure,696,N/A,0,en
The language of international communication,,Edicions Universitat Barcelona,2002,N/A,,400,N/A,0,en
