Title,Authors,Publisher,Published Date,Description,Categories,Page Count,Average Rating,Ratings Count,Language
Good Business,Bill Novelli,JHU Press,2021-02-02,"An inspiring and practical look inside the mind of Bill Novelli, one of the founders of social marketing, Good Business challenges all of us to change the world for the better and is a blueprint for tackling today's critical issues. From his humble beginnings selling soap in a sales training program to his rapid rise in the fast-paced New York advertising scene, Bill Novelli was well on his way to becoming a leader in the hypercompetitive business world. But it wasn't long before he became disillusioned with the drive for profits at any cost. He knew that his marketing skills made those companies successful, but what good did that success do for the world? That question sent him on a career path that involved taking the marketing and communication tactics long used by big businesses and applying them to social change. He found that this strategy was not only good for the world but also good for business. In Good Business, Novelli begins with his early career success in Mad Men–era marketing, which left him feeling unfulfilled. He describes the process of changing career trajectory: how he helped reposition the Peace Corps; built Porter Novelli, a global PR agency for social impact; fought the Tobacco Wars; and became CEO of AARP, the largest nonprofit in America. Drawing practical lessons and principles from play-by-play stories of his experiences in large and small organizations, Novelli deploys his characteristic wit to stress the importance of building and maintaining connections with people—and engaging them in the cause. Good Business, which is part behind-the-scenes look at crafting social and health policy, part inspirational guide, proves that you can do well (creating economic and financial success for yourself and your company or organization) by doing good (helping to solve the world's and society's major problems). Throughout the book, Novelli shows that you can make a positive social difference regardless of what business you are in or where you are in your career. Readers will come away with the message that anyone who wants to have a positive impact on the world can do it right now from where they are—or can be inspired by Novelli's story to make the leap to somewhere they can.",Biography & Autobiography,389,N/A,0,en
Family Businesses in the Arab World,Sami Basly,Springer,2017-05-18,"This book focuses on topics such as the cultural specificity of Arab family businesses with regard to shaping their governance and management; the influence that specific values in the Arab world could exert on the management of family businesses; how spiritual and religious values influence business in Arab family firms; and the role of emotions in the management of family firms in the Arab World. Presenting a collection of contributions addressing management, finance, strategy and succession in Arab Family businesses, this book constitutes a novel and unique contribution to the research field of family businesses.",Business & Economics,266,N/A,0,en
Old-age Pension Plans and Organizations,United States. Congress. House. Special Committee on Old-Age-Pension Plans,N/A,1936,N/A,"Insurance, Unemployment",1014,N/A,0,en
"United States of America Before the Securities and Exchange Commission in the Matter of Richard Whitney, Edwin D. Morgan, Jr., F. Kingsley Rodewald, Henry D. Mygatt, Daniel G. Condon, John J. McManus, and Estate of John A. Hayes, Individually and as Partners Doing Business as Richard Whitney & Company",United States. Securities and Exchange Commission,N/A,1938,N/A,Securities fraud,978,N/A,0,en
Business Bullshit,André Spicer,Routledge,2017-09-11,"Our organizations are flooded with empty talk. We are constantly ""going forward"" to lands of ""deliverables"", stopping off on the ""journey"" to ""drill down"" into ""best practice"". Being an expert at using management speak has become more important in corporate life than delivering long lasting results. The upshot is that meaningless corporate jargon is killing our organizations. In this book, management scholar the author argues we need to call this empty talk what it is: bullshit. The book looks at how organizations have become vast machines for manufacturing, distributing and consuming bullshit. It follows how the meaningless language of management has spread through schools, NGOs, politics and the media. Business Bullshit shows you how to spot business bullshit, considers why it is so popular, and outlines the impact it has on organizations and the people who work there. It also outlines what we can do to minimise bullshit at work. The author makes a case for why organizations need to avoid empty talk and reconnect with core activities.",Business & Economics,256,N/A,0,en
Making Money From Photography:,SJ Cutter,SJ Cutter,2023-01-01,"Could You Be Making Money With Photography? Right now, if you are: * A photographer struggling to attract well-paying clients? * Unsure how to start a full-time photography business? * Unsure how to price work? * Unsure which areas of photography pay best? * Lacking confidence and legitimacy as a professional/freelancer? * Working too many hours? * Struggling to balance your work, family and social lives? You need to read on.... There are key business secrets to ALL businesses. These secrets are the difference between wondering about business success and actually succeeding for yourself. In my book, I share mine: The secrets of making money with photography. Armed with the knowledge I share, you'll become a confident freelancer. You'll be able to start a successful photography business and get paid what you're worth. You'll work smarter too. You'll be a top 10% earner in the country you live and have spare time for other things. My secrets show you how. Contents: Split into 3 core chapters, my book holds honest, realistic and easily actionable secrets I've used as a successful photographer since 2007. CHAPTER 1 - Eight key principles are outlines relating to photography and making money. They formulate a business mindset. This chapter is available for free as a sample here. CHAPTER 2 - I take the business mindset and attach it to the business of photography. Here, I want my readers to understand realistic markets and something I refer to as a 'business cycle'. I set out strategies focused entirely on customers/clients, how to find them, keep them and bring them back. No expensive advertising or social media successes required! CHAPTER 3 - I share precise secrets, tips and tricks about the areas of photography I've worked in and made my money from. Key Learning: * Getting paid what you're worth and become a top 10% earner where you live. * Feeling legitimate as a full-time professional. * Knowing what to shoot. * Knowing how and when to say no. * Confidence in all business activities from pricing to talking about what you do. * Understanding how important a functioning business cycle is. * Shooting styles and techniques to feed your business cycle. * Communication styles and techniques to feed your business cycle. * Specific marketing tips and tricks for landing certain types of work. Are you ready to start marking money from photography? Everything shared in this book is broad and comprehensive. Nothing requires invisible prerequisites. Everything is honest, realistic and universally actionable to almost anyone. Importantly, using the secrets in my book, being a top 10% earner where you live is realistic and achievable. It's also in line with the honest, realistic ethos of my book (I'm not a millionaire, not many people are and I'm not selling that kind of nonsense). Being a top 10% earner means making a great living to almost anyone and I show you how to achieve it. I can't wait for you to get started!",Business & Economics,156,N/A,0,en
Replacing the Federal Income Tax,United States. Congress. House. Committee on Ways and Means,N/A,1996,N/A,Business & Economics,1078,N/A,0,en
"Antoszewski v. City Plumbing Co., 185 MICH 215 (1915)",,N/A,1915,17,,188,N/A,0,en
S-Business,"James A. Alexander, Mark Hordes","SelectBooks, Inc.",2003,"In business, seeing the next paradigm shift in how to effectively navigate a company to achieve high performance and competitive advantage isn't just important-it's crucial. In their new book, S-Business: Reinventing the Services Organization, James A. Alexander and Mark Hordes offer a comprehensive and focused approach by which decision-makers in product, professional services and support services organizations can embrace services as a strategic weapon. This is the essence of S-Business.Giant organizations like IBM and General Electric, once thought of as pure product companies, are actively implementing s-business strategies. IBM Global Services generates more than $33 billion in annual revenue; for each dollar earned on software, $162 is paid out in services. Professional services firms such as Accenture and McKinsey are reinventing their marketing, delivery and alliances to meet the ever expanding issues and needs of customers and clients for comprehensive services. All segments of the economy will be touched by the new s-business paradigm shift. No organization of any size, in any market or geography, can afford not to implement an s-business strategy.",Business & Economics,274,3,1,en
Taxpayer's Comprehensive Guide to LLCs and S Corps,Jason Watson,Watson CPA Group,2014-09-03,"How can I avoid self-employment taxes? This simple question was the inspiration for creating an article describing the benefits of an S Corporation. That original article, which was about four pages long, quickly became a series of KnowledgeBase articles on the Watson CPA Group website. The articles touched on basic topics such as how to elect S Corp status, payroll, reasonable salary determination, retirement planning, health care, fringe benefits and liability protection. Those broad topics demanded much more information, both horizontally by spanning into more related issues, and vertically by digging deeper into the granular yet riveting levels of the tax code. The articles were grouped and relabeled as the Taxpayer’s Comprehensive Guide to LLCs and S Corps which grew to 39 pages in its first edition. Time marched on, and more information was added to the first edition such as expanded retirement planning concerns, health care options after the Affordable Care Act and business valuations including exit strategies. Boom, we now had our second edition at over 100 pages. At that point it was suggested by some clients and colleagues to convert the PDF into an eBook as well as paperback. So here we are.. Each week we receive several phone calls and emails from small business owners across the country who have read our Taxpayer’s Comprehensive Guide to LLCs and S Corps and praised the wealth of information. Regardless of your current situation, whether you are considering starting your own business or entertaining a contracting gig, or you are an experienced business owner, the contents of this book are for you. This book will show you how to reduce your self-employment taxes through an S Corporation election and how to use your corporation to your retirement and fringe benefit advantage. You will also learn the operational considerations of an S Corp plus the 185 reasons you should NOT elect S Corp status. Want to buy or sell a business? That’s in here too. This book is written with the general taxpayer in mind. Too many resources simply regurgitate complex tax code without explanation. While in some cases tax code and court opinions are duplicated verbatim because of the precise words, this book strives to explain many technical concepts in layperson terms with some added humor and opinions. We believe you will find this book educational as well as amusing.",Business & Economics,136,N/A,0,en
How to Start and Run Your Own Corporation,Peter I. Hupalo,HCM Publishing,2003,"""How To Start And Run Your Own Corporation"" begins where many incorporation books leave off. Peter Hupalo, author of ""Thinking Like An Entrepreneur,"" teaches you the basics of corporate business structure. ""How To Start And Run Your Own Corporation"" will help you understand: * Which Business Structure Might Be Best For You * How To Decide Between An S-Corporation And A LLC * How To Choose Your State Of Incorporation * How To Form Your Own Corporation * S-Corporations * Par Value And No Par Value Stock * Issuing Shares * Stock Basis * Valuing A Small Business Corporation * Financing A Corporation Through Equity And Loans * Attracting Angel Investors For Your Corporation * Shareholder S-Corporation Basis And The AAA * Filling Out The 1120S Corporate Income Tax Return * Special Issues For One-Person Corporations * The Role of Bylaws And Corporate Minutes * The Role of Directors And Officers * Withdrawing Money From Your Corporation * Social Security/Unemployment Insurance On Officer Salaries * Qualified Retirement Plans, SIMPLE-IRA, SEP-IRA * The One-Person 401(k) * Worker's Compensation Exemption For Officers * How To Minimize Your Taxes * How To Prevent Your Corporate Shield From Being Pierced * Tax Saving Strategies For Your Corporation",Business & Economics,0,N/A,0,en
Business Dynamics: Systems Thinking and Modeling for a Complex World with CD-ROM,John Sterman,McGraw-Hill Education,2000-02-23,"Today’s leading authority on the subject of this text is the author, MIT Standish Professor of Management and Director of the System Dynamics Group, John D. Sterman. Sterman’s objective is to explain, in a true textbook format, what system dynamics is, and how it can be successfully applied to solve business and organizational problems. System dynamics is both a currently utilized approach to organizational problem solving at the professional level, and a field of study in business, engineering, and social and physical sciences.",Business & Economics,982,N/A,0,en
How to Start a Business in Minnesota,Entrepreneur Press,N/A,2003,"This series covers the federal, state, and local regulations imposed on small businesses, with concise, friendly and up-to-the-minute advice on each critical step of starting your own business.",Commercial law,0,N/A,0,en
Key Business Solutions,Antonio E. Weiss,Pearson UK,2012-09-19,"This book explains how to resolve every challenge faced on a day-to-day basis in your business by presenting an unbeatable inventory of proven problem solving tools and techniques to help you tackle your toughest business dilemmas effectively. You will learn how to: Overcome any business challenge with robust logic and structure How to break down problems and make your workload lighter Deliver the ‘killer’ recommendations Discover how to successfully implement change in people and organisations How to keep yourself, your team, and your stakeholders happy How to use an effective hypothesis-driven approach to problem solving Using case studies, a ‘best practice example’ and at least one figurative table or figure, every dilemma is bought to life equipping you with the very best tools to confront any problem your business may face. The full text downloaded to your computer With eBooks you can: search for key concepts, words and phrases make highlights and notes as you study share your notes with friends eBooks are downloaded to your computer and accessible either offline through the Bookshelf (available as a free download), available online and also via the iPad and Android apps. Upon purchase, you'll gain instant access to this eBook. Time limit The eBooks products do not have an expiry date. You will continue to access your digital ebook products whilst you have your Bookshelf installed.",Business & Economics,173,N/A,0,en
Programs and Schools,,N/A,1978,N/A,,348,N/A,0,en
How to Start a Business in Tennessee,Entrepreneur Press,N/A,2003-09-25,"This series covers the federal, state, and local regulations imposed on small businesses, with concise, friendly and up-to-the-minute advice on each critical step of starting your own business.",New business enterprises,0,N/A,0,en
The Business School for People who Like Helping People,"Robert T. Kiyosaki, Sharon L. Lechter",N/A,2005,"""In this Second Edition of his bestselling book, Robert T. Kiyosaki updates and expands his original eight ""hidden values"" of a network marketing business (other than making money!) Special Bonus-three additonal ""hidden values"" from Kim Kiyosaki and Sharon Lechter""--Page 4 of cover.",Multilevel marketing,123,N/A,0,en
The Complete Guide to Buying a Business,Fred S. Steingold,Nolo,2015-07-01,"Takes readers from thinking, “Hmm, should I buy a business?” right through the process of choosing, investigating, and entering into a legal contract to do so.",Business & Economics,441,N/A,0,en
Strategic Planning for The Family Business,"R. Carlock, J. Ward",Springer,2001-01-29,"Family business planning has traditionally centered on two issues - estate planning and succession. These goals are far too limited for today's family firm. Business families want to turn the business into not only a tool for profit, but for self-expression, innovation and legacy. The authors introduce the new concept of the Parallel Planning Process, explaining how to integrate the needs and expectations of the family and business systems in order to create an organic and entrepreneurial unit. Planning and decision making templates are included as well as studies of well-known family businesses.",Business & Economics,289,N/A,0,en
Shared Services,"Donniel S. Schulman, Martin J. Harmer, John R. Dunleavy, James S. Lusk",Wiley,1999-03-08,"""One of the ways companies are looking for competitive advantage in this frenetic [business] environment . . . is through the use of a tactical technique called shared services. . . . In this book, we bridge [the] chasm between the theory of how a shared services operation 'ought to' work and the practical issues involved in how to make it work, how to carry out a successful implementation of a shared service operation in your business.""-from the Preface. Gaining competitive advantage in today's fierce business environment requires focus throughout the company on value, as measured by quality, cost, speed, and service. In the quest for superior performance, a growing number of companies are now turning to shared services, a tactical technique by which corporations can organize financial and other transaction-oriented activities to reduce costs and provide better service to business unit partners. Written by four authorities, three PricewaterhouseCoopers consultants and the executive who has directed the shared service efforts at Lucent Technologies, this comprehensive resource-the first of its kind-examines shared services from the macro issues that compel senior management to embrace this approach through the design and implementation of a shared services environment that leads to increased customer and shareholder value. Of all the tools available for gaining competitive advantage, why shared services? One of the principal reasons is that it creates, through consolidation of often disparate activities, more of a ""one company"" feel among business units. The benefits of this are twofold: one, it enables companies to show a consistent face to clients and customers, vendors and suppliers, shareholders and potential shareholders; two, it provides increased flexibility to all of the business' operations, allowing corporate leaders to maintain a global perspective while at the same time allowing business unit leaders to take strong, customer-focused actions. Providing both a domestic and global view, Shared Services addresses the full spectrum of issues, including: * Assessing whether shared services is right for you-issues to consider, goals to be reached. * Getting started-building support, establishing an effective organization, instituting continuous communication. * Setting up the infrastructure-billing shared services to business units, dealing with tax and legal entity issues. * International challenges-complexity, time zone, legal issues, currency stability, and security. * Program and project management-structures, planning, execution, and control. A groundbreaking book that examines a timely and important topic, Shared Services is an accessible and thorough guide to what could be a critical component in achieving long-term business success. This comprehensive resource is the first to introduce, explain, and explore shared services, an innovative business strategy that involves centralizing various business units, including accounting and transactional operations, to reduce costs and increase customer satisfaction. Presenting a practical and easy-to-follow blueprint for the smooth and sound implementation of shared services in your organization, Shared Services: Adding Value to the Business Units covers all the fundamentals, from how to get started to proper management techniques.",Business & Economics,0,N/A,0,en
Introductory Business Statistics 2e,"Alexander Holmes, Barbara Illowsky, Susan Dean",,2023-12-13,"Introductory Business Statistics 2e aligns with the topics and objectives of the typical one-semester statistics course for business, economics, and related majors. The text provides detailed and supportive explanations and extensive step-by-step walkthroughs. The author places a significant emphasis on the development and practical application of formulas so that students have a deeper understanding of their interpretation and application of data. Problems and exercises are largely centered on business topics, though other applications are provided in order to increase relevance and showcase the critical role of statistics in a number of fields and real-world contexts. The second edition retains the organization of the original text. Based on extensive feedback from adopters and students, the revision focused on improving currency and relevance, particularly in examples and problems. This is an adaptation of Introductory Business Statistics 2e by OpenStax. You can access the textbook as pdf for free at openstax.org. Minor editorial changes were made to ensure a better ebook reading experience. Textbook content produced by OpenStax is licensed under a Creative Commons Attribution 4.0 International License.",Business & Economics,1801,N/A,0,en
Hearings,United States. Congress. House. Committee on Veterans' Affairs,N/A,1965,N/A,,1784,N/A,0,en
British Qualifications,Kogan Page,Kogan Page Publishers,2006,"The field of professional, academic and vocational qualifications is ever-changing. The new edition of this highly successful and practical guide provides thorough information on all developments. Fully indexed, it includes details on all university awards and over 200 career fields, their professional and accrediting bodies, levels of membership and qualifications.It acts as an one-stop guide for careers advisors, students and parents, and will also enable human resource managers to verify the qualifications of potential employees.",Business & Economics,1080,N/A,0,en
Report of the Commissioner of Education,United States. Office of Education,N/A,1917,N/A,Education,690,N/A,0,en
The Code of Federal Regulations of the United States of America,,N/A,1996,The Code of Federal Regulations is the codification of the general and permanent rules published in the Federal Register by the executive departments and agencies of the Federal Government.,Administrative law,580,N/A,0,en
Capital Tax Acts 2021,Michael Buckley,Bloomsbury Publishing,2021-04-09,"Now in its twenty-ninth edition, this indispensable guide to capital taxes provides the reader with annotated legislation in the areas of stamp duty, CAT and local property tax. All changes brought by the Finance Act 2020 are included. All relevant information issued by the Revenue Commissioners is also included. Each section of the book takes the area of tax it deals with and runs through each Act and SI which is relevant to it, with notes which detail definitions, amendments, cross-references, e-Briefings, Tax Briefings, former enactments and relevant case law.",Law,1742,N/A,0,en
Research in Organizational Change and Development,"Debra A. Noumair, Abraham B. (Rami) Shani, Danielle P. Zandee",Emerald Group Publishing,2023-01-16,Volume 30 of Research in Organizational Change and Development brings together contributions from colleagues around the globe with powerful insights and potentially relevant impact for researching and practicing organization change and development during and post the pandemic.,Business & Economics,225,N/A,0,en
Foundations of Taxation Law 2022,Stephen Barkoczy,Cambridge University Press,2022-01-25,"Foundations of Taxation Law provides a clear and comprehensive introduction to the policy, principles and practice underpinning the Australian taxation system. Designed as an introductory guide for law and business students as well as tax practitioners, the text focuses on general principles, blending policy issues, taxation theory, technical 'black letter law' and commercial practice into a succinct, principled text. Topics have been developed in a logical, structured order and are cross-referenced to specific provisions in the legislation and relevant cases so that readers can easily find the source of the law. The text includes approximately 400 examples and dozens of diagrams and tables that condense the law and clarify difficult concepts. This fourteenth edition has been substantially revised and restructured to take account of many important legislative reforms, case law developments, administrative changes and policy announcements. It is designed to be used in conjunction with the Core Tax Legislation and Study Guide 2022.",Law,1151,N/A,0,en
