Title,Authors,Publisher,Published Date,Description,Categories,Page Count,Average Rating,Ratings Count,Language
Jharkhand Board Accountancy Class 11,"Dr. S. K. Singh, , Dr. Sanjay Kumar Singh, Shailesh Chauhan",SBPD Publications ,2024-03-15,"1. Introduction to Accounting, 2. Basic Accounting Terms or Terminology, 3. Theory Base of Accounting : Accounting Principles Fundamental Assumptions or Concepts, 4. Accounting Standards and IFRS, 5. Double Entry System, 6. Process and Bases of Accounting 7. Origin of Transactions : Source Documents and Vouchers, 8. Accounting Equation, 9. Rules of Debit and Credit, 10. Recording of Business Transactions : Books of Original Entry—Journal, 11. Ledger, 12. Special Purpose (Subsidiary) Books (I) : Cash Book, 13. Special Purpose (Subsidiary) Books (II), 14. Bank Reconciliation Statement, 15. Trial Balance and Errors, 16. Depreciation, 17. Provisions and Reserves, 18. Accounting for Bills of Exchange, 19. Rectification of Errors, 20. Capital and Revenue Expenditures and Receipts, 21. Financial Statements/Final Accounts (Without Adjustment), 22. Final Accounts (With Adjustment), 23. Accounts from Incomplete Records or Single Entry System. UNIT : Computer in Accounting 1. Introduction to Computer and Accounting Information System (AIS), 2. Applications of Computer in Accounting, 3. Accounting and Database System : Project Work Appendix : Dictionary of Accounting",Business & Economics,995,N/A,0,en
Study Material & Question Bank,YCT Expert Team ,YOUTH COMPETITION TIMES,N/A,UPSC EPFO & APFC Study Material & Question Bank,Antiques & Collectibles,129,N/A,0,en
Congressional Record,United States. Congress,N/A,1959,N/A,Law,1188,N/A,0,en
The Insurance Year Book,,N/A,1922,N/A,Insurance,1574,N/A,0,en
"Cracking the GMAT with 2 Computer-Adaptive Practice Tests, 2018 Edition",Princeton Review,Princeton Review,2017-05,"IF IT'S ON THE TEST, IT'S IN THIS BOOK. Get all the prep you need to ace the GMAT--including 2 full-length computer-adaptive practice tests for realistic exam preparation, up-to-date content reviews for every test section, and extra practice online. Techniques That Actually Work. - Step-by-step problem-solving guides for the toughest question types - Detailed examples of how to use process of elimination to your advantage - Key strategies to help you work smarter, not harder Everything You Need to Know to Help Achieve a High Score. - Comprehensive subject coverage of all GMAT topics - A thorough review of necessary Math, Verbal, Writing, and Integrated Reasoning skills - Bulleted chapter summaries for quick reference Practice Your Way to Perfection. - 2 full-length CAT practice exams with online score reports and detailed answer explanations - Diagnostic warm-ups that help focus your review - 180+ additional practice questions, sorted by difficulty, to customize your prep - Drills for each test section in the book, plus additional Math, Verbal, and Integrated Reasoning drills online",,722,N/A,0,en
Fundamentals of Entrepreneurship For B.Com. Sem.-4 (According to NEP-2020),Prof. R.C. Agarwal,SBPD Publishing House,2023-04-29,"Table of Content:- 1. Entrepreneurship : Meaning, Concept, Characteristics, Need, Functions 2. Theories of Entrepreneurship 3. Entrepreneur : Meaning, Characteristics, Qualities, Functions and Types 4. Entrepreneurship Development Programmes 5. Women Entrepreneur 6. Promotion of a Venture (Business) 7. Project : Concept, Classification And Identification 8. Project Formulation and Report 9. Project Appraisal/Resource Assessment (Financial and Non-Financial) 10. Raising of Funds 11. Venture Capital and Documentation Requirements 12. Plant Layout 13. Selection of Product 14. Location of an Enterprise 15. Choice of Organisation 16. Facilities and Technologies For Starting Enterprise 17. Small Scale Industries in India 18. Institutional Finance to Entrepreneurs 19. Legal Requirements For Establishment of a New Unit 20. Institutions For Entrepreneurial Development. More Information:- The author of this book is Dr. O.P. Gupta. Dr. O.P. Gupta is the ex-reader of Deptt. of Commerce in PGDAV College, University of Delhi, Delhi.",Business & Economics,248,N/A,0,en
"Questions and Answers on Federal Tax Laws, Problems Affecting Individuals, Partnerships and Corporations, January, 1924",Irving Bank-Columbia Trust Company,N/A,1924,N/A,Income tax,156,N/A,0,en
Federal Acquisition Circular,United States. Department of Defense,N/A,N/A,N/A,Government purchasing,608,N/A,0,en
CORPORATE ACCOUNTING (English Edition),"Dr. Shweta Mishra   , Dr. Pooja Yadav , Dr. Ashish Srivastava ",Thakur Publication Private Limited,2023-07-01,"Discover the comprehensive guide to Corporate Accounting in the English Edition book tailored specifically for B.Com 5th Semester students of U.P State Universities. Aligned with the latest NEP-2020 syllabus, this book, published by Thakur Publication, offers a structured approach to mastering the complexities of corporate financial reporting, analysis, and decision-making. Enhance your understanding of essential concepts and gain practical insights through real-world examples, exercises, and case studies.",Education,352,N/A,0,en
EPFO Assistant Full Mock Test 2021. Download Guide in PDF Here!,testbook.com,Testbook.com,2021-07-22,"Attempt EPFO Assistant Full Mock Test 2021. Get expert solved examples on English, Quant and Reasoning, key concepts & answer key to crack EPFO Assistant 2021 exam.",Study Aids,10,N/A,0,en
Nolo Contendere and Private Antitrust Enforcement,United States. Congress. Senate. Committee on the Judiciary,N/A,1967,N/A,,336,N/A,0,en
Business Plans for Dummies,"Paul Tiffany, Colin Barrow, Steven D. Peterson",N/A,2004,"Business Plans For Dummies can guide your business in the right direction no matter who you are or how your job description reads, whether you're part of a large corporation or a one-person show. If you've struggled through the planning process before -- or if you're brand new to plotting out goals and objectives -- this down-to-earth guide steps you through every milestone in business planning.",Business,0,N/A,0,en
NASA Reports Required by Congress,"United States. Congress. House. Committee on Science, Space, and Technology. Subcommittee on Space Science and Applications",N/A,1990,N/A,Aeronautics,1196,N/A,0,en
The Code of Federal Regulations of the United States of America,,N/A,1984,The Code of Federal Regulations is the codification of the general and permanent rules published in the Federal Register by the executive departments and agencies of the Federal Government.,Administrative law,720,N/A,0,en
CRYPTOCURRENCY,NARAYAN CHANGDER,CHANGDER OUTLINE,2024-02-29,"THE CRYPTOCURRENCY MCQ (MULTIPLE CHOICE QUESTIONS) SERVES AS A VALUABLE RESOURCE FOR INDIVIDUALS AIMING TO DEEPEN THEIR UNDERSTANDING OF VARIOUS COMPETITIVE EXAMS, CLASS TESTS, QUIZ COMPETITIONS, AND SIMILAR ASSESSMENTS. WITH ITS EXTENSIVE COLLECTION OF MCQS, THIS BOOK EMPOWERS YOU TO ASSESS YOUR GRASP OF THE SUBJECT MATTER AND YOUR PROFICIENCY LEVEL. BY ENGAGING WITH THESE MULTIPLE-CHOICE QUESTIONS, YOU CAN IMPROVE YOUR KNOWLEDGE OF THE SUBJECT, IDENTIFY AREAS FOR IMPROVEMENT, AND LAY A SOLID FOUNDATION. DIVE INTO THE CRYPTOCURRENCY MCQ TO EXPAND YOUR CRYPTOCURRENCY KNOWLEDGE AND EXCEL IN QUIZ COMPETITIONS, ACADEMIC STUDIES, OR PROFESSIONAL ENDEAVORS. THE ANSWERS TO THE QUESTIONS ARE PROVIDED AT THE END OF EACH PAGE, MAKING IT EASY FOR PARTICIPANTS TO VERIFY THEIR ANSWERS AND PREPARE EFFECTIVELY.",Business & Economics,88,N/A,0,en
UGC NET Economics in English [Question Bank ] Unit Wise / Topic Wise 5000 + [MCQ] Question Answer As Per New Updated Syllabus,DIWAKAR EDUCATION HUB ,DIWAKAR EDUCATION HUB,2021-10-06,"UGC NET Economics Unit Wise 5000+ Practice Question Answer As Per New Updated Syllabus Second Edition MCQs Highlights - Complete Units Cover Include All 10 Units Question Answer 500 Practice Question Answer Each Unit Total 5000+ Practice Question Answer Try to take all topics MCQ Include Oriented & Most Expected Question Answer As Per the New Updated Syllabus For More Details Call /What's App -7310762592,7078549303",Antiques & Collectibles,1119,N/A,0,en
Accounting,"Kenneth W. Boyd, Kate Mooney",John Wiley & Sons,2015-04-13,"Get up to speed quickly—review and practice major concepts in accounting! Whether you're looking to improve your classroom experience, or simply become more familiar with accounting concepts, 1,001 Accounting Practice Problems For Dummies is the hands-on tool you need to get a step ahead. The book's practice questions and review content go hand-in-hand with the content offered in Accounting For Dummies, ensuring that you have a working knowledge of the most important concepts and skills in accounting. This practical resource gives you access to tons of helpful online content, including practice problems in multiple-choice format, and customizable practice sets for self-directed study, all available on the go through your smartphone, laptop, or tablet. Practice problems are categorized as easy, medium, or hard, so you can build your knowledge at your own pace. A perfect companion for anyone looking to increase their accounting skills, this book has the added benefit of offering review and practice useful for individuals looking to pass their accounting courses and lay the groundwork for an accounting career. Filled with practice questions, review content, tips, and explanations for anyone interested in accounting principles Includes tons of online practice content, such as multiple choice questions and customizable practice sets, all available with purchase of the book Ideal for individuals looking to pass an accounting class or start a career in accounting Serves as an excellent companion resource to Accounting For Dummies Packed with endless practice opportunities, 1,001 Accounting Practice Problems For Dummies has everything you need to jumpstart your journey into accounting and financial documentation.",Business & Economics,391,N/A,0,en
Business Finance - SBPD Publications,Dr. F. C. Sharma,SBPD Publications,2021-12-17,"1. Business Finance : Nature and Scope, 2. Financial Management : Nature and Scope, 3. Capital Budgeting and Investment Decisions, 4. Cost of Capital, 5. Capitalisation, 6. Capital Structure, 7. Dividend Policy, 8. Sources of Business Finance, 9. Financial Institutions, 10. Financial Planning, 11. Working Capital Management, 12. Capital Market, 13. New Issue (Primary) Market, 14. Secondary (Stock) Market, 15. Stock Exchanges of India, 16. Indian Money Market.",Business & Economics,357,N/A,0,en
Federal Register,,N/A,1960-11,N/A,Delegated legislation,936,N/A,0,en
Commonwealth Register,,N/A,1994,N/A,Delegated legislation,398,N/A,0,en
New York Real Estate Exam Review,Eileen Taus,Dearborn Real Estate,2003-10,"Prepare your salesperson and broker students for their licensing exams with this self paced workbook based on the New York State Board of Real Estate content outline. Recently updated, this comprehensive review follows the chapters of Modern Real Estate Practice in New York the state's leading salesperson and broker textbook. Highlights include: * Over 550 study questions written in New York examstyle will prepare students for the licensing exam. * Two salesperson and broker exams help studentsconquer test taking anxieties. * Test taking strategies explores the structure of theexam questions. * Q & A Topic Review covers the most important topicsfrom Modern Real Estate Practice in New Yorkthe state's leading salesperson and broker textbook.",Business & Economics,186,N/A,0,en
Oswal - Gurukul Accountancy Most Likely Question Bank : CBSE Class 12 for 2023 Exam,Oswal - Gurukul,Oswal Publishers,2022-06-10,N/A,Education,806,N/A,0,en
"Cracking the GMAT with 2 Practice Tests, 2014 Edition",Princeton Review,Princeton Review,2013-07-16,"THE PRINCETON REVIEW GETS RESULTS. Get all the prep you need to ace the GMAT with 2 full-length practice tests, coverage of all GMAT topics, and extra practice online. This eBook version of Cracking the GMAT has been specially formatted for on-screen viewing with cross-linked questions, answers, and explanations. Inside the Book: All the Practice & Strategies You Need • Diagnostic exam sections to assess where you stand • Over 180 additional practice test questions sorted by difficulty • Complete subject review of all GMAT test topics • Drills for every section, from data sufficiency to reading comprehension • Step-by-step instruction on the Integrated Reasoning question types • Proven techniques like Process of Elimination and Plugging In The Answers for raising your score Exclusive Access to More Practice and Resources Online • 2 additional full-length practice exams • Instant score reports for all multiple-choice questions • Full answer explanations & free performance analysis • Extra math and verbal drills to hone your technique • Informational updates on the Integrated Reasoning section",Study Aids,705,N/A,0,en
FCC Record,United States. Federal Communications Commission,N/A,1990-12,N/A,Telecommunication,934,N/A,0,en
UGC NET economics unit-3 Statistics and Econometrics book with 500 question answer as per updated syllabus,DIWARAR EDUCATION HUB ,DIVAKAR  EDUCATION HUB ,2022-08-19,UGC NET economics unit-3,Business & Economics,366,N/A,0,en
Introduction to Tom Cruise,"Gilad James, PhD",Gilad James Mystery School,N/A,"Tom Cruise is a well-known American actor and producer. He was born on July 3rd, 1962 in Syracuse, New York. He grew up in poverty, with his father frequently absent due to his job as a salesman. Cruise was interested in acting from a young age and began pursuing it in high school. After a brief stint in college, he moved to New York City to pursue acting full-time. Cruise's breakthrough role came in the film Risky Business in 1983. He went on to star in a number of successful films throughout the 1980s and 1990s, including Top Gun, Rain Man, and Jerry Maguire. Cruise is known for his intense dedication to his craft and his willingness to perform his own stunts in action films. He has been nominated for three Academy Awards and has won three Golden Globe Awards. In addition to acting, he is also a prominent member of the Church of Scientology and has been involved in several controversies surrounding the organization. Despite these controversies, Cruise remains one of the most successful and well-known actors in Hollywood. Overall, Tom Cruise's career has spanned decades and he has become a household name in the entertainment industry. He has starred in a wide range of films and has been praised for his acting abilities and dedication to his craft. Despite some personal controversies, many fans continue to support him and eagerly anticipate his future projects.",Performing Arts,58,N/A,0,en
Law for CA-PCC/IPC,Tulsian P.C. & Tulsian Bharat,S. Chand Publishing,2010,Introduction  Tearing And Cutting  Special Effects With Paper  Fixing Paper Down  The World Of Paper  Step By Step  Working With Colour  Exploring Tone  Marbling And Rubbing  Working With Photos  Photomontage  Drawing With Collage  Working With Fabric  Three -Dimensional Collage  A Diary In Collage  Gifts And Presentation  Practical Tips  Index,Study Aids,871,N/A,0,en
Occupational Outlook Quarterly,,N/A,1966,N/A,Occupations,294,N/A,0,en
IB ACIO Grade II/Executive Exam 2023 (English Edition) - 10 Practice Tests and 5 Previous Year Papers (1500 Solved Objective Questions),EduGorilla Prep Experts,EduGorilla Community Pvt. Ltd.,N/A,• Best Selling Book in English Edition for IB ACIO Grade II / Executive Exam with objective-type questions as per the latest syllabus given by the Ministry of Home Affairs (MHA). • IB ACIO Grade II / Executive Exam Preparation Kit comes with 10 Practice Tests and 5 Previous Year Papers) with the best quality content. • Increase your chances of selection by 16X. • IB ACIO Grade II / Executive Exam Prep Kit comes with well-structured and 100% detailed solutions for all the questions. • Clear exam with good grades using thoroughly Researched Content by experts.,Education,167,N/A,0,en
23 Practice Sets for IBPS RRB Officer Scale 1 Preliminary & Mains Exam with 4 Online Tests 4th Edition,Disha Experts,Disha Publications,2019-04-24,"23 Practice Sets for IBPS RRB Officer Scale 1 Preliminary Exam is written exclusively for the New pattern Prelim Exam being conducted by IBPS for recruitment in RRB Officer Scale 1 segment. The book provides 23 Practice Sets - 19 (17 in Book + 2 Online) for the Preliminary Exam & 4 (2 in Book + 2 Online) for the Mains Exam. Each of the Prelim Tests contains the 2 sections - Reasoning Ability and Quantitative Aptitude as per the latest pattern. Whereas each of the Mains Tests contains the 5 sections with option among English & Hindi Language as per the latest pattern. The solution to each Test is provided at the end of the book. This book will really help the students in developing the required Speed and Strike Rate, which will increase their final score in the exam.",Study Aids,221,N/A,0,en
COPPER SUN,NARAYAN CHANGDER,CHANGDER OUTLINE,2024-05-14,"THE COPPER SUN MCQ (MULTIPLE CHOICE QUESTIONS) SERVES AS A VALUABLE RESOURCE FOR INDIVIDUALS AIMING TO DEEPEN THEIR UNDERSTANDING OF VARIOUS COMPETITIVE EXAMS, CLASS TESTS, QUIZ COMPETITIONS, AND SIMILAR ASSESSMENTS. WITH ITS EXTENSIVE COLLECTION OF MCQS, THIS BOOK EMPOWERS YOU TO ASSESS YOUR GRASP OF THE SUBJECT MATTER AND YOUR PROFICIENCY LEVEL. BY ENGAGING WITH THESE MULTIPLE-CHOICE QUESTIONS, YOU CAN IMPROVE YOUR KNOWLEDGE OF THE SUBJECT, IDENTIFY AREAS FOR IMPROVEMENT, AND LAY A SOLID FOUNDATION. DIVE INTO THE COPPER SUN MCQ TO EXPAND YOUR COPPER SUN KNOWLEDGE AND EXCEL IN QUIZ COMPETITIONS, ACADEMIC STUDIES, OR PROFESSIONAL ENDEAVORS. THE ANSWERS TO THE QUESTIONS ARE PROVIDED AT THE END OF EACH PAGE, MAKING IT EASY FOR PARTICIPANTS TO VERIFY THEIR ANSWERS AND PREPARE EFFECTIVELY.",Technology & Engineering,63,N/A,0,en
UGC NET Law Unit-5 LAW OF TORTS AND CONSUMER PROTECTION book theory + 400 Question Answer as per Syllabus,DIWAKAR EDUCATION HUB,DIWAKAR EDUCATION HUB,2022-08-18,theory + MCQ of UGC NET Law Unit-5 LAW OF TORTS AND CONSUMER PROTECTION,Biography & Autobiography,118,N/A,0,en
E-Business and ERP,Murrell G. Shields,John Wiley & Sons,2004-03-15,"Proven strategies for companies seeking to accelerate an ERP implementation Almost all large and midsize corporations worldwide will be involved in implementing enterprise resource planning and/or e-business applications over the next two to three years. This is the only book that discusses how to implement a rapid ERP system and shows how e-business is impacted by the implementation of an ERP system. This book also provides valuable tried and true methods of keeping the project under or within budget. A quality ERP transaction foundation is a prerequisite for taking advantage of many of the new e-business opportunities that executives have placed high on their list of priorities. This valuable guide examines the strengths and weaknesses of ERP and shows when rapid implementation is not appropriate. The book also provides outsourcing alternatives and the use of application service alternatives, and shows how e-business is impacted by the implementation of an ERP system. Murrell G. Shields (McLean, VA) is the Director of Management Solutions and Services and National Leader of Technology and Infrastructure Services at Deloitte & Touche.",Business & Economics,287,N/A,0,en
Business Wargames,Barrie G. James,Taylor & Francis,1985,"First Published in 1985. Routledge is an imprint of Taylor & Francis, an informa company.",Business & Economics,256,N/A,0,en
Building Business Solutions,"Ronald G. Ross, Gladys S. W. Lam",N/A,2011,N/A,Strategic planning,304,N/A,0,en
Family Business Models,"A. Gimeno, G. Baulenas, J. Coma-Cros",Springer,2010-05-13,"An exceptional new work on family business, showing how to maintain a balanced relationship between the family and the company, and ensure satisfactory business results. This roadmap helps the reader to build better managed and more stable family firms.",Business & Economics,199,N/A,0,en
"Entrepreneurship, Innovation and Business Clusters",Panos G. Piperopoulos,"Gower Publishing, Ltd.",2012,"In Entrepreneurship, Innovation and Business Clusters, Dr Panos Piperopoulos provides a comprehensive introduction to what entrepreneurship is all about, how and why entrepreneurs innovate and how innovation systems operate. Acknowledging that what are now known as small and medium enterprises (SMEs) constitute the backbone of most economies, the author then examines in depth the characteristics of SMEs and the crucial role played by the owners and entrepreneurs who innovate to ensure the survival and continued growth of their firms.",Business & Economics,242,N/A,0,en
Principles of the Business Rule Approach,Ronald G. Ross,Addison-Wesley Professional,2003,"The idea of Business Rules has been around for a while. Simply put, a Business Rule is a statement that defines or constrains some aspect of the business. In practice they are meant to reduce or eliminate the delays, waste, and frustration associated with the IT department having to be involved with almost every action affecting an organization's information systems. The advent of Web services has created renewed interest in them. There are now several well established rules-based products that have demonstrated the effectiveness of their use. But until now there has not been a definitive guide to Business Rules. Ron Ross, considered to be the father of Business Rules, will help organizations apply this powerful solution to their own computer system problems. This book is intended to be the first book that anyone from an IT manager to a business manager will read to understand what Business Rules are, and what how they can be applied to their own situation.",Business & Economics,404,5,3,en
A Lapsed Anarchist's Approach to Building a Great Business,Ari Weinzweig,Zingerman's Press,2010-10-15,"The first in a series of books by Zingerman's co-founding partner Ari Weinzweig examines the basic building blocks of the culture and structure we know now as Zingerman's. These approaches are applicable whether you're running a law office, a library, a restaurant, a record label, a software firm, or an organic farm. They are the behind-the-scenes ""secret"" stuff that goes into making a very special, sustainable business of any kind. Inc. Magazine calls it one of the Best Books for Business Owners.",,361,N/A,0,en
"Public Utility Holding Company Act of 1935, as Amended Oct. 15, 1970",United States,N/A,1971,N/A,Holding companies,44,N/A,0,en
Investigation of Concentration of Economic Power,United States. Temporary National Economic Committee,N/A,1939,N/A,Big business,2464,N/A,0,en
Code of Federal Regulations,,N/A,1968,N/A,Administrative law,1552,N/A,0,en
1980 Census of Population,,N/A,1983,N/A,Missouri,662,N/A,0,en
Registry of Minority Contractors and Housing Professionals,United States. Department of Housing and Urban Development. Office of the Assistant Secretary for Equal Opportunity,N/A,1973,N/A,Construction industry,942,N/A,0,en
Investigation of Concentration of Economic Power,United States. Congress. House. Temporary National Economic Committee,N/A,1940,N/A,United States,1840,N/A,0,en
Kill Or Be Killed,Robert Scott,Kensington Books,2004-09,"Recreates the horrific events in May of 1998 when Norman Daniels and Dale Gordon, believing that they were to be inducted into a secret organization comprised of assassins called the Company, killed their friend's pregnant wife to prove their worth. Original.",True Crime,372,N/A,0,en
The Northwestern Reporter,,N/A,1892,N/A,"Law reports, digests, etc",2336,N/A,0,en
Title 29 - Labor (Parts 1927-END),Federal Register,ProStar Publications,2006-07,N/A,Law,1102,N/A,0,en
Lynch V. Commissioner of Internal Revenue,,N/A,1954,N/A,,196,N/A,0,en
Federal Register,,N/A,1960-12,N/A,Delegated legislation,720,N/A,0,en
Bankable Business Plans,Edward G. Rogoff,Rowhouse Publishing,2007,"This book guides readers through a very comprehensive, step-by-step process to produce professional-quality business plans to attract the financial backing entrepreneurs need, no matter what their dream.",Business & Economics,284,N/A,0,en
Hearings,United States. Congress Senate,N/A,1940,N/A,,2800,N/A,0,en
Annual Report of the Secretary of State ...,Ohio. Secretary of State,N/A,1899,"1868-1909/10, 1915/16- include the Statistical report of the secretary of state in continuation of the Annual report of the commissioner of statistics.",Ohio,868,N/A,0,en
Congressional Record,United States. Congress,N/A,1904,N/A,Law,1012,N/A,0,en
"The City of Detroit, Michigan, 1701-1922;",Clarence Monroe Burton,N/A,1922,N/A,Detroit (Mich.),1020,N/A,0,en
"History of Kossuth and Humbolt Counties, Iowa",,N/A,1884,N/A,Humboldt County (Iowa),900,N/A,0,en
1980 Census of Population and Housing,,N/A,1983,N/A,Housing,716,N/A,0,en
